{
  "$schema": "https://raw.githubusercontent.com/liangboqiang/TjuaeHub/main/schemas/tjuae-skill.v1.schema.json",
  "format": "agent-skill",
  "formatVersion": 1,
  "id": "xiaohongshu-recruiter",
  "version": "1.0.0",
  "categories": ["招聘", "社交媒体"],
  "tags": [],
  "compatibility": {},
  "requirements": [],
  "contentHash": "sha256-b9acfb94eeaa592bbed1f7fc341ea44e236072ec323ffe43ebd1b94d26f98ddf",
  "extensions": {}
}
