{
  "$schema": "https://raw.githubusercontent.com/liangboqiang/TjuaeHub/main/schemas/tjuae-skill.v1.schema.json",
  "format": "agent-skill",
  "formatVersion": 1,
  "id": "tjuaeui-webui-setup",
  "version": "1.0.0",
  "categories": ["WebUI", "部署"],
  "tags": [],
  "compatibility": {},
  "requirements": [],
  "contentHash": "sha256-1a94e77e5cdb879f43b69799b6887f959735f351c6c4261508d8fdcc1fb48ce8",
  "extensions": {}
}
