{
  "$schema": "https://raw.githubusercontent.com/liangboqiang/TjuaeHub/main/schemas/tjuae-skill.v1.schema.json",
  "format": "agent-skill",
  "formatVersion": 1,
  "id": "pdf",
  "version": "1.0.0",
  "categories": ["文档", "PDF"],
  "tags": [],
  "compatibility": {},
  "requirements": [],
  "contentHash": "sha256-3eada8f84bc98e3fd6b0d73db45537aa66f975b4bdaf3ab30ceea2ef1ebd4623",
  "extensions": {}
}
